[{"artifact_id":"artifact:2dce6ccb144fcee4e7086e61cf238dbc76585c50ea2bc647a75724c85385eede","artifact_type":"ci-workflow","capabilities":[],"confidence":{"authority":"validated-machine","completeness":"sufficient","conflict_status":"none","derivation_method":"deterministic","evidence_strength":"corroborated","level":"high"},"content_hash":"sha256:0835e0871dcb86d1574e8451fbac455179cdff3493b895e9aa627f524d59ed5f","dependencies":[],"evidence_refs":["evidence:69a738878ad517887bb645a85d8020726f36ac3d8c9b988befd492ab82c9f402"],"packet_ref":"urn:l9:legacy-scan:l9-mcp-server:sha256:b0d3d89f622da21653c9df9f7fad9cdd880b1ada444fbc5dbbcf6ad349d78180","repository_id":"repo:l9-mcp-server","source_path":".github/workflows/deploy.yml"},{"artifact_id":"artifact:5f126e3f65e9973b75f256931c8f56ef5c10fce96dc6be43eee0442b7d3eaf71","artifact_type":"documentation","capabilities":[],"confidence":{"authority":"validated-machine","completeness":"sufficient","conflict_status":"none","derivation_method":"deterministic","evidence_strength":"corroborated","level":"high"},"content_hash":"sha256:f42715e6afb33e6999fd0ff624680ed601a790c82fd607573f4c403c1c517619","dependencies":[],"evidence_refs":["evidence:9745cf9f5aa2a55d0d0ec956f595a9102051224f6da654c5e756128b06ba6c50"],"packet_ref":"urn:l9:legacy-scan:l9-gate-sdk:sha256:2f1b01a06ce09c949f818027a0253710d380f477824e09127a848d862d3943d7","repository_id":"repo:l9-gate-sdk","source_path":"README.md"},{"artifact_id":"artifact:9c1767f9bb12ecc3e5fb0fe32b10a967ecadd3960c4ebb25e402edab71fbe95e","artifact_type":"documentation","capabilities":[],"confidence":{"authority":"validated-machine","completeness":"sufficient","conflict_status":"none","derivation_method":"deterministic","evidence_strength":"corroborated","level":"high"},"content_hash":"sha256:71864d43673f2d130e79554a863834986ef3ef50e1d68d087a53aaf4e19595ea","dependencies":[],"evidence_refs":["evidence:944d594375fc539e595d57462092de4c3af2837ec28ab2be4712373efd08be46"],"packet_ref":"urn:l9:legacy-scan:l9-mcp-server:sha256:b0d3d89f622da21653c9df9f7fad9cdd880b1ada444fbc5dbbcf6ad349d78180","repository_id":"repo:l9-mcp-server","source_path":"README.md"},{"artifact_id":"artifact:af3d308e231a7968eea3d46457851b19a65324e505028f3f905659b54e859ecc","artifact_type":"package-manifest","capabilities":[],"confidence":{"authority":"validated-machine","completeness":"sufficient","conflict_status":"none","derivation_method":"deterministic","evidence_strength":"corroborated","level":"high"},"content_hash":"sha256:365c084c2bbd84decd3e58607d0feada037a79e106d992bba247f8e6f13f1b67","dependencies":[],"evidence_refs":["evidence:08ca8f0cd96a01443445b6387276901fbaf327dffc2300a6db16a341bf1959ef","evidence:557d52b82c0b9cf39a92ad68dc6f894ce490cfced8974cea75adcd3eea642d8e","evidence:ad85781ad2fab7fd28d63dd6e14ddbc6fa1d3b54ce1978223c93bc704ae485e5"],"packet_ref":"urn:l9:legacy-scan:l9-gate-sdk:sha256:2f1b01a06ce09c949f818027a0253710d380f477824e09127a848d862d3943d7","repository_id":"repo:l9-gate-sdk","source_path":"pyproject.toml"},{"artifact_id":"artifact:c1f3dea4a6f3b19b6e14b37ffaeceeb7eb450c94a643a239b5cb11605e3c0a1d","artifact_type":"package-manifest","capabilities":[],"confidence":{"authority":"validated-machine","completeness":"sufficient","conflict_status":"none","derivation_method":"deterministic","evidence_strength":"corroborated","level":"high"},"content_hash":"sha256:2d280f644b701a7bab5b3b36311eebc2afc4a02fde9554f137312513e8fd0b71","dependencies":[],"evidence_refs":["evidence:053ade54eab180cfb6442885f9b719e70855791f3ca2005aaf8172f26077af5a","evidence:8f4331cf9239c6121cb63ea3568998cdf31f0cf1cc1beef54201ac03d6ebd525","evidence:c87556ab9f0ac784f89a55b400f8a6c61be905b44e23f5d40e47aaa6c4a376a5","evidence:d538fed45f2e9814b7540a1928f642f4a07c1f6babca0d515e02a58b027be91a"],"packet_ref":"urn:l9:legacy-scan:l9-mcp-server:sha256:b0d3d89f622da21653c9df9f7fad9cdd880b1ada444fbc5dbbcf6ad349d78180","repository_id":"repo:l9-mcp-server","source_path":"pyproject.toml"},{"artifact_id":"artifact:d975b17685aec233a012ffd6a4d9f59013dd15d5e8723a70446ee95a40822a5a","artifact_type":"ci-workflow","capabilities":[],"confidence":{"authority":"validated-machine","completeness":"sufficient","conflict_status":"none","derivation_method":"deterministic","evidence_strength":"corroborated","level":"high"},"content_hash":"sha256:168e7170d0e655f08ebe3aae6378eedb468de6eef9382b09461bf6985b2b252c","dependencies":[],"evidence_refs":["evidence:2b5e0a5f4722f1f0912ed76f4154d926770011124bcbddbc892f04c67c9d4b15"],"packet_ref":"urn:l9:legacy-scan:l9-gate-sdk:sha256:2f1b01a06ce09c949f818027a0253710d380f477824e09127a848d862d3943d7","repository_id":"repo:l9-gate-sdk","source_path":".github/workflows/ci.yml"},{"artifact_id":"artifact:f7ede513d2b6b1728a049f3d5dfb16b8194a6c17f3fb71081af46f418542a4c0","artifact_type":"architecture-decision","capabilities":[],"confidence":{"authority":"validated-machine","completeness":"sufficient","conflict_status":"none","derivation_method":"deterministic","evidence_strength":"corroborated","level":"high"},"content_hash":"sha256:c8cecf10eb167bcbc680506f3ad8acd72e2903d1f5b6fc180e24f7264ff60b73","dependencies":[],"evidence_refs":["evidence:77ea38aad92ee15e35e79e63a72d6bf1578f61a214f76d96efe25ccbcbd4412c"],"packet_ref":"urn:l9:legacy-scan:l9-gate-sdk:sha256:2f1b01a06ce09c949f818027a0253710d380f477824e09127a848d862d3943d7","repository_id":"repo:l9-gate-sdk","source_path":"docs/adr/adr-001-transport-protocol.md"},{"artifact_id":"artifact:fe5b06075d3778c6952dc2966f2d90c521e9866bdec32b075d42c4efaca36838","artifact_type":"governance","capabilities":[],"confidence":{"authority":"validated-machine","completeness":"sufficient","conflict_status":"none","derivation_method":"deterministic","evidence_strength":"corroborated","level":"high"},"content_hash":"sha256:d6d7f3ee62a3c6df4815094c463bed25e239560a9fe4e94becab4f96e785ba10","dependencies":[],"evidence_refs":["evidence:d2338cd112c2b2367b1e129321fa71b7ea910795b0328749b40ebc0e454cd0e6"],"packet_ref":"urn:l9:legacy-scan:l9-gate-sdk:sha256:2f1b01a06ce09c949f818027a0253710d380f477824e09127a848d862d3943d7","repository_id":"repo:l9-gate-sdk","source_path":".github/CODEOWNERS"}]
